{
  "schema": 1,
  "game": {
    "title": "Guacamelee! 2",
    "program_id": "01007E100456C000",
    "version": "1.0.0",
    "content": "base"
  },
  "build": {
    "app_version": "0.0.1",
    "runtime_sha256": "9da6023b22445be511101872f3a66bf6ad528d43ab04ffa4eaa6b0df82856f1a",
    "apk_sha256": "e251e0a9dbd355b550185933c279c956819f954217374127a39c19846526f30e",
    "source_commit": null
  },
  "device": {
    "model": "AYN Thor",
    "soc": "Qualcomm QCS8550 (Adreno 740)",
    "gpu_driver": "Turnip Balemuni Apex v2 Ultimate (Mesa 26.3.0-devel)",
    "android": "13",
    "settings": "Continuous NCE; generic fallback; command lifetime disabled"
  },
  "test": {
    "date": "2026-10-27",
    "tester": "local automated run",
    "route": "Accepted untested-game warning, native preparation and SDK startup, then first controlled NVN recorder failure; no gameplay",
    "observation": "observed"
  },
  "result": {
    "state": "fails-startup",
    "limitations": [
      "NVN recorder rejects adding the active command chunk to itself",
      "Callback/direct-call cause and NVN compatibility assumptions need investigation",
      "No game-image or gameplay support claimed; selected GPU driver stays enabled after this controlled stop"
    ]
  }
}
